patent_id,patent_type,patent_date,patent_title,year
10002527,utility,2018-06-19,"Remote control mobile terminal, remote control system and remote control method",2018
10002528,utility,2018-06-19,IR communication method and electronic device thereof,2018
10002529,utility,2018-06-19,Operating table system,2018
10002530,utility,2018-06-19,Traffic signal control using multiple Q-learning categories,2018
10002531,utility,2018-06-19,Method and apparatus for predicting driving behavior,2018
10002532,utility,2018-06-19,Communication device and method,2018
10002533,utility,2018-06-19,"System, method and recording medium for emergency vehicle route guidance",2018
10002534,utility,2018-06-19,Vehicle driving assistance apparatus,2018
10002535,utility,2018-06-19,Dual-stage car finder,2018
10002536,utility,2018-06-19,Apparatus and method for providing service in vehicle to everything communication system,2018
10002537,utility,2018-06-19,Learning lanes from radar sensors,2018
10002538,utility,2018-06-19,Aircraft clearance enforcement,2018
10002539,utility,2018-06-19,Method and apparatus for integrated recording and playback of video audio and data inputs,2018
10002540,utility,2018-06-19,Interactive educational tool,2018
10002541,utility,2018-06-19,Musical modification method,2018
10002542,utility,2018-06-19,Method of playing a musical keyboard,2018
10002543,utility,2018-06-19,System and methods for transforming language into interactive elements,2018
10002544,utility,2018-06-19,Neuroplasticity games for depression,2018
10002545,utility,2018-06-19,"System and method for controlling gaming technology, musical instruments and environmental settings via detection of neuromuscular activity",2018
10002546,utility,2018-06-19,Spinal injection trainer and methods therefor,2018
10002547,utility,2018-06-19,"Secret calculation method, secret calculation system, random permutation device, and program",2018
10002548,utility,2018-06-19,"Methods, systems, and computer program products for providing personalized, just-in time information services",2018
10002549,utility,2018-06-19,Removable adhesive label containing polymeric film layer having water affinity,2018
10002550,utility,2018-06-19,System for reducing the release value of a label,2018
10002551,utility,2018-06-19,Bendable display device,2018
10002552,utility,2018-06-19,Light panel display apparatus for image sheet illumination,2018
10002553,utility,2018-06-19,"Method, system, and device for determining a location of micro digital signage devices",2018
10002554,utility,2018-06-19,Display device and method of detecting deterioration of the same,2018
10002555,utility,2018-06-19,Display apparatus and dipslay method,2018
10002556,utility,2018-06-19,Display control to alleviate transition of pixel to an undesired level of gradation over time,2018
10002557,utility,2018-06-19,Display device,2018
10002558,utility,2018-06-19,"Shift register unit and driving method thereof, gate driving circuit, and display device",2018
10002559,utility,2018-06-19,"Image display device, image display system, and image display method",2018
10002560,utility,2018-06-19,"Gate drive on array unit, gate drive on array circuit and display apparatus",2018
10002561,utility,2018-06-19,Perceptually configured array of addressable electromagnetic emitter elements,2018
10002562,utility,2018-06-19,Wear compensation for a display,2018
10002563,utility,2018-06-19,"Electro-optical device having pixel circuit and driving circuit, driving method of electro-optical device and electronic apparatus",2018
10002564,utility,2018-06-19,"Display device, display module, and electronic device",2018
10002565,utility,2018-06-19,"Display unit, method of driving the same, and control pulse generation device",2018
10002566,utility,2018-06-19,Organic light emitting display device and method of driving the same,2018
10002567,utility,2018-06-19,"Pixel circuit, active matrix apparatus and display apparatus with first and second reference potentials applied to gate and other terminal of drive transistor",2018
10002568,utility,2018-06-19,"Display unit, display unit driving method, and electronic apparatus with deterioration suppression",2018
10002569,utility,2018-06-19,Organic light emitting display device,2018
10002570,utility,2018-06-19,Electronic display driving scheme systems and methods,2018
10002571,utility,2018-06-19,Liquid crystal display incorporating color-changing backlight,2018
10002572,utility,2018-06-19,"Liquid crystal monitor device, display system, and backlight control method",2018
10002573,utility,2018-06-19,Field sequential display device and drive method therefor,2018
10002574,utility,2018-06-19,"Method, apparatus for display compensation and display device",2018
10002575,utility,2018-06-19,Driving methods and circuit for bi-stable displays,2018
10002576,utility,2018-06-19,Light modulating backplane with configurable multi-electrode pixels,2018
10002577,utility,2018-06-19,"Color adjustment method and device, liquid crystal display",2018
10002578,utility,2018-06-19,Moving impurity ions in a liquid crystal display device,2018
10002579,utility,2018-06-19,Display device,2018
10002580,utility,2018-06-19,Semiconductor display device,2018
10002581,utility,2018-06-19,Liquid crystal display and a driving method thereof,2018
10002582,utility,2018-06-19,Driver and electronic device,2018
10002583,utility,2018-06-19,Display drive circuit and display panel,2018
10002584,utility,2018-06-19,"Information processing apparatus, information providing method, and information providing system",2018
10002585,utility,2018-06-19,Selectively transmitting signals,2018
10002586,utility,2018-06-19,Compression of display data stored locally on a GPU,2018
10002587,utility,2018-06-19,Display apparatus and method for controlling display apparatus,2018
10002588,utility,2018-06-19,Electronic paper display device,2018
10002589,utility,2018-06-19,Retaining user selected screen area on user equipment,2018
10002590,utility,2018-06-19,Display device for sensing gesture and method of driving the same,2018
10002591,utility,2018-06-19,Display device and image rendering method thereof,2018
10002592,utility,2018-06-19,Displaying method of electronic device using a cover and electronic device thereof,2018
10002593,utility,2018-06-19,Guitar capo applicable to different kinds of guitars,2018
10002594,utility,2018-06-19,Adjustable neck stiffener for stringed musical instruments,2018
10002595,utility,2018-06-19,Rhino resonator and flute crown,2018
10002596,utility,2018-06-19,Intelligent crossfade with separated instrument tracks,2018
10002597,utility,2018-06-19,System for electronically generating music,2018
10002598,utility,2018-06-19,Selective pitch emulator for electrical stringed instruments,2018
10002599,utility,2018-06-19,Pickup assembly for an electrical stringed musical instrument,2018
10002600,utility,2018-06-19,Gesture pad and integrated transducer-processor unit for use with stringed instrument,2018
10002601,utility,2018-06-19,In-vehicle communication signal processing,2018
10002602,utility,2018-06-19,Method and system for reducing fan noise and electronic device using the same,2018
10002603,utility,2018-06-19,System and method for actively influencing sound,2018
10002604,utility,2018-06-19,Voice synthesizing method and voice synthesizing apparatus,2018
10002605,utility,2018-06-19,Method and system for achieving emotional text to speech utilizing emotion tags expressed as a set of emotion vectors,2018
10002606,utility,2018-06-19,Automatic accuracy estimation for audio transcriptions,2018
10002607,utility,2018-06-19,Cross device companion application for phone,2018
10002608,utility,2018-06-19,System and method for using prosody for voice-enabled search,2018
10002609,utility,2018-06-19,Device and method for generating recognition network by adjusting recognition vocabulary weights based on a number of times they appear in operation contents,2018
10002610,utility,2018-06-19,"Presentation supporting device, presentation supporting method, and computer-readable recording medium",2018
10002611,utility,2018-06-19,Asynchronous audio messaging,2018
10002612,utility,2018-06-19,"Systems, computer-implemented methods, and tangible computer-readable storage media for transcription alignment",2018
10002613,utility,2018-06-19,Determining hotword suitability,2018
10002614,utility,2018-06-19,Determining the inter-channel time difference of a multi-channel audio signal,2018
10002615,utility,2018-06-19,Inter-channel level difference processing method and apparatus,2018
10002616,utility,2018-06-19,Audio decoding device,2018
10002617,utility,2018-06-19,Bandwidth extension of harmonic audio signal,2018
10002618,utility,2018-06-19,Sample rate converter with automatic anti-aliasing filter,2018
10002619,utility,2018-06-19,Unified speech/audio codec (USAC) processing windows sequence based mode switching,2018
10002621,utility,2018-06-19,Apparatus and method for decoding an encoded audio signal using a cross-over filter around a transition frequency,2018
10002622,utility,2018-06-19,Irregular pattern identification using landmark based convolution,2018
10002623,utility,2018-06-19,Speech-processing apparatus and speech-processing method,2018
10002624,utility,2018-06-19,Magnetic disk device using head amplifier circuit for pattern dependent write,2018
10002625,utility,2018-06-19,Recording head with multiple magnetic writers simultaneously writing to adjacent tracks,2018
10002626,utility,2018-06-19,Corrosion resistance cap located on end of waveguide core,2018
10002627,utility,2018-06-19,Tape head with electrically conducting surface to reduce triboelectric charging,2018
10002628,utility,2018-06-19,Piezoelectric motors including a stiffener layer,2018
10002629,utility,2018-06-19,Disk drive suspension assembly having a partially flangeless load point dimple,2018
10002630,utility,2018-06-19,Adaptive attenuation for disturbance compensation,2018
10002631,utility,2018-06-19,Head-medium contact detection using a thermal sensor heated by multiple heat generating components of a slider,2018
10002632,utility,2018-06-19,Recording medium with thin stabilization layer having high magnetic saturation and anisotropic field characteristics,2018
10002633,utility,2018-06-19,"Optical disk, optical disk recording method, optical disk recording device, and integrated circuit",2018
10002634,utility,2018-06-19,Optical disc and optical disc device,2018
10002635,utility,2018-06-19,Systems and methods for information capture,2018
10002636,utility,2018-06-19,Method for creating RFID copy sheets,2018
10002637,utility,2018-06-19,Magnetic recording and reproducing device and method of controlling magnetic recording and reproducing device,2018
10002638,utility,2018-06-19,System and method for time delayed playback,2018
10002639,utility,2018-06-19,Sanitization of voice records,2018
10002640,utility,2018-06-19,Hyper-lapse video through time-lapse and stabilization,2018
10002641,utility,2018-06-19,Systems and methods for determining highlight segment sets,2018
10002642,utility,2018-06-19,Methods and devices for generating media items,2018
10002643,utility,2018-06-19,"Reproducing apparatus, correlated information notifying method, and correlated information notifying program",2018
10002644,utility,2018-06-19,Restructuring video streams to support random access playback,2018
10002645,utility,2018-06-19,Laminate-wrapped hard disk drives and related methods,2018
10002646,utility,2018-06-19,Local bit lines and methods of selecting the same to access memory elements in cross-point arrays,2018
10002647,utility,2018-06-19,Apparatuses and methods for sharing transmission vias for memory devices,2018
10002648,utility,2018-06-19,"Memory device, semiconductor device, and electronic device",2018
10002649,utility,2018-06-19,Preliminary ready indication for memory operations on non-volatile memory,2018
10002650,utility,2018-06-19,Signal quality detection circuit for generating signal quality detection result according to two-dimensional nominal sampling point pattern and associated signal quality detection method,2018
10002651,utility,2018-06-19,Semiconductor devices,2018
10002652,utility,2018-06-19,Memory system and method for operating the same,2018
10002653,utility,2018-06-19,Die stack address bus having a programmable width,2018
10002654,utility,2018-06-19,Capacitive wordline boosting,2018
10002655,utility,2018-06-19,Memory cell structure of magnetic memory with spin device elements,2018
10002656,utility,2018-06-19,Semiconductor device and electronic device,2018
10002657,utility,2018-06-19,Enhanced memory device,2018
10002658,utility,2018-06-19,Dynamic random-access memory with embedded artificial neural network functionality,2018
10002659,utility,2018-06-19,System and method for decoding commands based on command signals and operating state,2018
10002660,utility,2018-06-19,Transistor gain cell with feedback,2018
10002661,utility,2018-06-19,Structure for reducing pre-charge voltage for static random-access memory arrays,2018
10002662,utility,2018-06-19,Semiconductor device,2018
10002663,utility,2018-06-19,Nonvolatile memory apparatus and resistance compensation circuit thereof,2018
10002664,utility,2018-06-19,Non-volatile resistive memory cell comprising metal electrodes and a solid electrolyte between the metal electrodes,2018
10002665,utility,2018-06-19,Memory devices formed from correlated electron materials,2018
10002666,utility,2018-06-19,FeRAM-DRAM hybrid memory,2018
10002667,utility,2018-06-19,Memory device,2018
10002668,utility,2018-06-19,"Memory device, memory module, and memory system",2018
10002669,utility,2018-06-19,"Method, system and device for correlated electron switch (CES) device operation",2018
10002670,utility,2018-06-19,Memory and memory control method,2018
10002671,utility,2018-06-19,Semiconductor memory device,2018
10002672,utility,2018-06-19,Memory device with progressive row reading and related reading method,2018
10002673,utility,2018-06-19,Flash memory data storage device and programming method thereof,2018
10002674,utility,2018-06-19,Method for operating a serial non-volatile semiconductor memory,2018
10002675,utility,2018-06-19,"Shift register unit, gate driving circuit and driving method, and display apparatus",2018
10002676,utility,2018-06-19,Nonvolatile memory device detecting defective bit line at high speed and test system thereof,2018
10002677,utility,2018-06-19,Test mode control circuit,2018
10002678,utility,2018-06-19,Redundant error detection in a clinical diagnostic analyzer,2018
10002679,utility,2018-06-19,System for bulk encoding medical items,2018
10002680,utility,2018-06-19,Pressure wave generator and controller for generating a pressure wave in a liquid medium,2018
10002681,utility,2018-06-19,Fuel assembly,2018
10002682,utility,2018-06-19,Nuclear reactor having plate or micro-channel heat exchangers integrated in the vessel,2018
10002683,utility,2018-06-19,Storing hazardous material in a subterranean formation,2018
10002684,utility,2018-06-19,Copper alloy and method for manufacturing the same,2018
10002685,utility,2018-06-19,Charge-transporting thin film,2018
10002686,utility,2018-06-19,Method of infusing fibrous substrate with conductive organic particles and conductive polymer; and conductive fibrous substrates prepared therefrom,2018
10002687,utility,2018-06-19,Transparent conductive film,2018
10002688,utility,2018-06-19,Flexible electrical power cable,2018
10002689,utility,2018-06-19,"Metal sheathed cable with jacketed, cabled conductor subassembly",2018
10002690,utility,2018-06-19,Shielded conductive path,2018
10002691,utility,2018-06-19,"High-speed, high resolution ethernet cable",2018
10002692,utility,2018-06-19,"Method for manufacturing a resin-impregnatable sheet-like spacer for a highvoltage component, a spacer manufactured according to the method, a highvoltage component comprising the spacer and an arrangement for performing the method",2018
10002693,utility,2018-06-19,High-power compact electrical resistor,2018
10002694,utility,2018-06-19,"Inductor including alpha″-Fe16Z2 or alpha″-Fe16(NxZ1-x)2, where Z includes at least one of C, B, or O",2018
10002695,utility,2018-06-19,Method for manufacturing rare-earth magnets,2018
10002696,utility,2018-06-19,Wiring assembly and method of forming a channel in a wiring assembly for receiving conductor and providing separate regions of conductor contact with the channel,2018
10002697,utility,2018-06-19,Superconducting magnet device,2018
10002698,utility,2018-06-19,Valve having a magnetic actuator,2018
10002699,utility,2018-06-19,Electromagnetic coil driving control device,2018
10002700,utility,2018-06-19,Vertical-coupling transformer with an air-gap structure,2018
10002701,utility,2018-06-19,Profiling transformer of power system,2018
10002702,utility,2018-06-19,Coupler for use in a power distribution system,2018
10002703,utility,2018-06-19,Embedded magnetic component transformer device,2018
10002704,utility,2018-06-19,Coil module,2018
10002705,utility,2018-06-19,Coil device,2018
10002706,utility,2018-06-19,Coil and manufacturing method thereof,2018
10002707,utility,2018-06-19,Induction coil structure for wireless charging device,2018
10002708,utility,2018-06-19,Coil unit and wireless power transmission device,2018
10002709,utility,2018-06-19,Wireless charging device for an electronic device,2018
10002710,utility,2018-06-19,Ceramic multilayer wiring substrate and module including the same,2018
10002711,utility,2018-06-19,Low temperature multilayer dielectric film for passivation and capacitor,2018
10002712,utility,2018-06-19,Multi-layer capacitor package and package housing,2018
10002713,utility,2018-06-19,Self-damping MLCC array,2018
10002714,utility,2018-06-19,Dielectric film and dielectric element,2018
10002715,utility,2018-06-19,Energy storage capacitor having composite electrode structure,2018
10002716,utility,2018-06-19,Electron transport structure and perovskite solar cell having the same,2018
10002717,utility,2018-06-19,High performance lithium-ion capacitor laminate cells,2018
10002718,utility,2018-06-19,Lithium ion capacitor,2018
10002719,utility,2018-06-19,"Separator having binder layer, and electrochemical device comprising the separator and method of preparing the separator",2018
10002720,utility,2018-06-19,Preparation of metal oxide-graphene composite films,2018
10002721,utility,2018-06-19,Multiple contact circuit breaker,2018
10002722,utility,2018-06-19,Switching system for breaking a current and method of performing a current breaking operation,2018
10002723,utility,2018-06-19,Switch,2018
10002724,utility,2018-06-19,Switch actuator with haptic and audible feedback,2018
10002725,utility,2018-06-19,Keyswitch,2018
10002726,utility,2018-06-19,Membrane switch and method of manufacturing the same,2018
10002727,utility,2018-06-19,Keycaps with reduced thickness,2018
10002728,utility,2018-06-19,Light-emitting keyboard,2018
10002729,utility,2018-06-19,Electronic device with slidable control button,2018
10002730,utility,2018-06-19,Inhibiter switch,2018
10002731,utility,2018-06-19,Rocker input mechanism,2018
10002732,utility,2018-06-19,Side break air switch with anti-rolling blade lock,2018
10002733,utility,2018-06-19,Internal tulip sleeve of the female arcing contact of a high voltage electric circuit breaker,2018
10002734,utility,2018-06-19,"Contractor with micro-solenoid and device for retention of core of micro-solenoid for motor vehicle starter, and corresponding starter",2018
10002735,utility,2018-06-19,Trip light circuit breaker,2018
10002736,utility,2018-06-19,Double make double break interrupter module with independent blades,2018
10002737,utility,2018-06-19,Fuse module and fusible disconnect switch assembly therefor,2018
10002738,utility,2018-06-19,Simplified formation process of a low work function insert,2018
10002739,utility,2018-06-19,X-ray emitter,2018
10002740,utility,2018-06-19,Inspection device,2018
10002741,utility,2018-06-19,Electron microscope with plural X-ray detectors for acquiring elemental spectrum,2018
10002742,utility,2018-06-19,Composite scan path in a charged particle microscope,2018
10002743,utility,2018-06-19,Measurement system and measurement method,2018
10002744,utility,2018-06-19,System and method for controlling plasma density,2018
10002745,utility,2018-06-19,Plasma treatment process for in-situ chamber cleaning efficiency enhancement in plasma processing chamber,2018
10002746,utility,2018-06-19,Multi regime plasma wafer processing to increase directionality of ions,2018
10002747,utility,2018-06-19,Methods and apparatus for supplying process gas in a plasma processing system,2018
10002748,utility,2018-06-19,Detection of grounding strap breakage,2018
10002749,utility,2018-06-19,Extinguishing arcs in a plasma chamber,2018
10002750,utility,2018-06-19,Field asymmetric ion mobility spectrometry filter,2018
10002751,utility,2018-06-19,Ion beam irradiation apparatus,2018
10002752,utility,2018-06-19,Systems and methods for determining the suitability of RF sources in ultraviolet systems,2018
10002753,utility,2018-06-19,Chamfering apparatus and method for manufacturing notchless wafer,2018
10002754,utility,2018-06-19,Substrate processing method and recording medium,2018
10002755,utility,2018-06-19,Process for deposition of titanium oxynitride for use in integrated circuit fabrication,2018
10002756,utility,2018-06-19,Fin-FET device and fabrication method thereof,2018
10002757,utility,2018-06-19,Selectively lateral growth of silicon oxide thin film,2018
10002758,utility,2018-06-19,Compositions and methods of rinsable primers used to aid in the removal of temporary functional coatings,2018
10002759,utility,2018-06-19,Method of forming structures with V shaped bottom on silicon substrate,2018
10002760,utility,2018-06-19,Method for manufacturing SiC wafer fit for integration with power device manufacturing technology,2018
10002761,utility,2018-06-19,Method for forming a multiple layer epitaxial layer on a wafer,2018
10002762,utility,2018-06-19,Multi-angled deposition and masking for custom spacer trim and selected spacer removal,2018
10002763,utility,2018-06-19,Fabrication of substrates with a useful layer of monocrystalline semiconductor material,2018
10002764,utility,2018-06-19,Sputter etch material selectivity,2018
10002765,utility,2018-06-19,FinFET structure with different fin heights and method for forming the same,2018
10002766,utility,2018-06-19,High pressure low thermal budge high-k post annealing process,2018
10002767,utility,2018-06-19,Aluminum oxide landing layer for conductive channels for a three dimensional circuit device,2018
10002768,utility,2018-06-19,Semiconductor device and manufacturing method thereof,2018
10002769,utility,2018-06-19,"Method for functionalizing a solid substrate, other than a substrate made of gold, via specific chemical compounds",2018
10002770,utility,2018-06-19,Substrate processing device and substrate processing method for carrying out chemical treatment for substrate,2018
10002771,utility,2018-06-19,Methods for chemical mechanical polishing (CMP) processing with ozone,2018
10002772,utility,2018-06-19,Vapor phase etching of hafnia and zirconia,2018
10002773,utility,2018-06-19,Method for selectively etching silicon oxide with respect to an organic mask,2018
10002774,utility,2018-06-19,Metal interconnect processing for a non-reactive metal stack,2018
10002775,utility,2018-06-19,Method of manufacturing semiconductor device,2018
10002776,utility,2018-06-19,"Wafer manufacturing cleaning apparatus, process and method of use",2018
10002777,utility,2018-06-19,Substrate processing system and substrate processing method,2018
10002778,utility,2018-06-19,Substrate cleaning apparatus,2018
10002779,utility,2018-06-19,Thermal array system,2018
10002780,utility,2018-06-19,Method of manufacturing a semiconductor structure,2018
10002781,utility,2018-06-19,Tool auto-teach method and apparatus,2018
10002782,utility,2018-06-19,ESC assembly including an electrically conductive gasket for uniform RF power delivery therethrough,2018
10002783,utility,2018-06-19,Method for manufacturing memory device,2018
10002784,utility,2018-06-19,Via corner engineering in trench-first dual damascene process,2018
10002785,utility,2018-06-19,Air-gap assisted etch self-aligned dual Damascene,2018
10002786,utility,2018-06-19,Interconnection cells having variable width metal lines and fully-self aligned variable length continuity cuts,2018
10002787,utility,2018-06-19,Staircase encapsulation in 3D NAND fabrication,2018
10002788,utility,2018-06-19,Methods of fabricating semiconductor devices,2018
10002789,utility,2018-06-19,High performance middle of line interconnects,2018
10002790,utility,2018-06-19,Mechanisms for forming semiconductor device structure with feature opening,2018
10002791,utility,2018-06-19,Multi-layer work function metal gates with similar gate thickness to achieve multi-Vt for vFETS,2018
10002792,utility,2018-06-19,HDP fill with reduced void formation and spacer damage,2018
10002793,utility,2018-06-19,Sub-fin doping method,2018
10002794,utility,2018-06-19,Multiple gate length vertical field-effect-transistors,2018
10002795,utility,2018-06-19,Method and structure for forming vertical transistors with shared gates and separate gates,2018
10002796,utility,2018-06-19,Dual epitaxial growth process for semiconductor device,2018
10002797,utility,2018-06-19,Chip integration including vertical field-effect transistors and bipolar junction transistors,2018
10002798,utility,2018-06-19,Structure and method for tensile and compressive strained silicon germanium with same germanium concentration by single epitaxy step,2018
10002799,utility,2018-06-19,Ion implantation method and ion implantation apparatus performing the same,2018
10002800,utility,2018-06-19,Prevention of charging damage in full-depletion devices,2018
