patent_id,patent_type,patent_date,patent_title,year
10005008,utility,2018-06-26,Waste disposal systems and methods,2018
10005009,utility,2018-06-26,Strainer for a filling port,2018
10005010,utility,2018-06-26,Filter device,2018
10005011,utility,2018-06-26,Velocity reducing pool filter port,2018
10005012,utility,2018-06-26,Interlock device,2018
10005013,utility,2018-06-26,"Apparatus for filtering and/or conditioning and/or purifying a fluid such as water, and interface thereof for providing water boiler expansion pressure relief",2018
10005014,utility,2018-06-26,Additive carrier for spin on filters,2018
10005015,utility,2018-06-26,Electrostatic filter and method of installation,2018
10005016,utility,2018-06-26,Hydrophobic filtration of tempering air,2018
10005018,utility,2018-06-26,Xenon collection method and system,2018
10005019,utility,2018-06-26,Carbon dioxide concentration-controlling device and electronic apparatus,2018
10005020,utility,2018-06-26,"Method for treating impurities contained in exhaust gases of ships, ship with a scrubber, and purification unit",2018
10005021,utility,2018-06-26,System and method for recovering ammonia from a gas stream,2018
10005022,utility,2018-06-26,Systems and methods for CO2 removal from flue gas by temperature swing absorption,2018
10005023,utility,2018-06-26,Method and system for CO2 rejection with a two stage membrane process,2018
10005024,utility,2018-06-26,Acidic-gas separation module,2018
10005025,utility,2018-06-26,Corrosion resistant abatement system,2018
10005026,utility,2018-06-26,Limestone supply device and air pollution control system,2018
10005027,utility,2018-06-26,Methods and systems for improving the energy efficiency of carbon dioxide capture,2018
10005028,utility,2018-06-26,Capturing method of carbon dioxide using hydrazine derivative,2018
10005029,utility,2018-06-26,Method and system for sequestering constituents and creating by products from a gas feed,2018
10005030,utility,2018-06-26,Flue gas treatment system and method,2018
10005031,utility,2018-06-26,Dual-layer catalyst,2018
10005032,utility,2018-06-26,Carbon dioxide recovery apparatus and carbon dioxide recovery method,2018
10005033,utility,2018-06-26,Isotopic enrichment of helium-3 through glass,2018
10005034,utility,2018-06-26,Seawater desalination system and energy recovery apparatus,2018
10005035,utility,2018-06-26,"Ion processing device, ion chromatograph provided with the ion processing device, and eluent generator provided with the ion processing device",2018
10005036,utility,2018-06-26,"Modular membrane housing, membrane housing elements and method for the production thereof",2018
10005037,utility,2018-06-26,Memrane filtration device having an improved design,2018
10005038,utility,2018-06-26,Hemodialysis and hemofiltration membranes based upon a two-dimensional membrane material and methods employing same,2018
10005039,utility,2018-06-26,"System for cleaning membrane, and method for cleaning membrane using same",2018
10005040,utility,2018-06-26,Forward osmotic and water hammer method of membrane cleaning,2018
10005041,utility,2018-06-26,Potting material for membrane modules and hollow fiber membrane module using same,2018
10005042,utility,2018-06-26,Thin film composite forward osmosis membranes with performance enhancing layers,2018
10005043,utility,2018-06-26,Gas separation membranes with intermixed layers,2018
10005044,utility,2018-06-26,Virus filter,2018
10005045,utility,2018-06-26,Method and device for producing composition having disperse phase dispersed in continuous phase,2018
10005046,utility,2018-06-26,Vaporization and transportation of alkali metal salts,2018
10005048,utility,2018-06-26,Manual mixer,2018
10005049,utility,2018-06-26,One-pass type dispersing and emulsifying apparatus,2018
10005050,utility,2018-06-26,Method for using a swing-type mixing device and a mixing device,2018
10005051,utility,2018-06-26,Vacuum pug mill,2018
10005052,utility,2018-06-26,Vessel for processing a biopharmaceutical product including protection means,2018
10005053,utility,2018-06-26,Particle packing apparatus,2018
10005054,utility,2018-06-26,Combination equalizer and inlet distributor for spherical reactor,2018
10005055,utility,2018-06-26,Rotary bottom ash regeneration system,2018
10005056,utility,2018-06-26,Fluidized catalyst stripping unit for displacing entrained gas from catalyst particles,2018
10005057,utility,2018-06-26,Segmented reactor for homogeneous regeneration of spent ionic liquid,2018
10005058,utility,2018-06-26,Compositions and methods for arranging colloid phases,2018
10005059,utility,2018-06-26,Methods for making low remnant free formaldehyde microcapsules and microcapsules made by same,2018
10005060,utility,2018-06-26,Drug provision system and drug provision method,2018
10005061,utility,2018-06-26,Ozone-based contaminant eradication system and method,2018
10005062,utility,2018-06-26,Apparatus for manufacturing particles and method for manufacturing particles using the same,2018
10005063,utility,2018-06-26,Method of adsorbing iodine or bromine,2018
10005064,utility,2018-06-26,Process for producing water-absorbing polymer particles,2018
10005065,utility,2018-06-26,"Adsorbent based on a zeolite and a silica-rich clay, and process for purifying hydrocarbon feeds containing unsaturated molecules",2018
10005066,utility,2018-06-26,Catalyst carrier and method for producing the same,2018
10005067,utility,2018-06-26,"Use of catalysts, method and apparatus for selective oxidation of ammonia in a gas containing hydrogen",2018
10005068,utility,2018-06-26,Catalyst and manufacturing method thereof,2018
10005069,utility,2018-06-26,Core-shell particles with catalytic activity,2018
10005070,utility,2018-06-26,Bimetallic mercaptan conversion catalyst for sweetening liquefied petroleum gas at low temperature,2018
10005071,utility,2018-06-26,"Mixed oxides of transition metals, hydrotreatment catalysts obtained therefrom and preparation process",2018
10005072,utility,2018-06-26,High matrix surface area catalytic cracking catalyst stabilized with magnesium and silica,2018
10005073,utility,2018-06-26,Process for manufacture of a zeolite based catalyst for the conversion of methanol to olefins,2018
10005074,utility,2018-06-26,"Molecular sieve material, its synthesis and use",2018
10005075,utility,2018-06-26,Passive NOx adsorber,2018
10005076,utility,2018-06-26,Synthesis of SAPO-18 and the catalytic applications thereof,2018
10005077,utility,2018-06-26,Zeolite nanosheet membrane,2018
10005078,utility,2018-06-26,Fuel synthesis catalyst and fuel synthesis system,2018
10005079,utility,2018-06-26,"Catalyst having a helical outer shape, improving hydrodynamics in reactors",2018
10005080,utility,2018-06-26,Instrument and cartridge for performing assays in a closed sample preparation and reaction system employing electrowetting fluid manipulation,2018
10005081,utility,2018-06-26,Apparatus and methods for aspirating and separating components of different densities from a physiological fluid containing cells,2018
10005082,utility,2018-06-26,Microfluidic circuit element comprising microfluidic channel with nano interstices and fabrication method thereof,2018
10005083,utility,2018-06-26,Optical alignment tool,2018
10005084,utility,2018-06-26,Overload fault condition detection system for article destruction device,2018
10005085,utility,2018-06-26,Ion filtration air cleaner,2018
10005086,utility,2018-06-26,"Exhaust output particulate filtration apparatus for combustion gases, exhaust gases",2018
10005087,utility,2018-06-26,Particle collector system and dust collection method,2018
10005088,utility,2018-06-26,Flotation of sphalerite from mixed base metal sulfide ores either without or with largely reduced amount of copper sulfate addition using 2-(alkylamino)ethanethiols as collectors,2018
10005089,utility,2018-06-26,Separator device,2018
10005090,utility,2018-06-26,Shower head structure,2018
10005091,utility,2018-06-26,Irrigation sprinkler,2018
10005092,utility,2018-06-26,Nozzle and substrate treating apparatus including the same,2018
10005093,utility,2018-06-26,Foreign object detecting device and coating system,2018
10005094,utility,2018-06-26,Apparatus for controlled application of liquid streams to a substrate with diverted liquid collection system,2018
10005095,utility,2018-06-26,Dispensing assemblies and related methods,2018
10005096,utility,2018-06-26,Disposable nozzle for an applicator for applying resin to the inside of a pre-creased garment or a piece of fabric,2018
10005097,utility,2018-06-26,Die for coating suspensions with flow obstruction device and method of use,2018
10005098,utility,2018-06-26,Power operated dispensing tool,2018
10005099,utility,2018-06-26,Production of highly oriented graphene oxide films and graphitic films derived therefrom,2018
10005100,utility,2018-06-26,Method for forming fine patterns,2018
10005101,utility,2018-06-26,Method of forming PNbZT ferroelectric thin film,2018
10005102,utility,2018-06-26,"Coated mat of inorganic fibers, and functional decorative layers, manufactured therefrom, in floor, ceiling and wall coverings",2018
10005103,utility,2018-06-26,Method for producing finely structured surfaces,2018
10005104,utility,2018-06-26,"Black coating film-forming vehicle component and/or fastening component, and manufacturing method thereof",2018
10005105,utility,2018-06-26,Ultrasonic sensor driving circuit,2018
10005106,utility,2018-06-26,Modular batch plant for granular products,2018
10005107,utility,2018-06-26,Workpiece sorting system and method,2018
10005108,utility,2018-06-26,Lens cleaning method for a surveillance camera,2018
10005109,utility,2018-06-26,Pneumatic pressure pulse cleaning machine,2018
10005110,utility,2018-06-26,Foam control composition,2018
10005111,utility,2018-06-26,Turbine engine cleaning systems and methods,2018
10005112,utility,2018-06-26,Method for lining existing ash basin and landfill sites,2018
10005113,utility,2018-06-26,Rolling stand for tubes or rounds,2018
10005114,utility,2018-06-26,Work roll cooling apparatus and method,2018
10005115,utility,2018-06-26,"Method and process, system, and apparatus for straightening of thin tubular shapes",2018
10005116,utility,2018-06-26,High frequency induction heating apparatus and processing apparatus,2018
10005117,utility,2018-06-26,End cap seaming apparatus and method for seaming an end cap,2018
10005118,utility,2018-06-26,Method for joining components made of high-strength steel,2018
10005119,utility,2018-06-26,Fastening method and apparatus,2018
10005120,utility,2018-06-26,Method for forming a joint using a self-piercing rivet,2018
10005121,utility,2018-06-26,"Apparatus for forming a blank for finish forging for a forged crankshaft for a 4-cylinder engine, and method for manufacturing a forged crankshaft for a 4-cylinder engine using the same",2018
10005122,utility,2018-06-26,Apparatus for forming a blank for finish forging for a forged crankshaft for a straight-6-cylinder engine and method for manufacturing a forged crankshaft for a straight-6-cylinder engine using the same,2018
10005123,utility,2018-06-26,Lost core molding cores for forming cooling passages,2018
10005124,utility,2018-06-26,Multiple pressure casting mold and molded product manufacturing method using same,2018
10005125,utility,2018-06-26,Hybrid turbine blade for improved engine performance or architecture,2018
10005126,utility,2018-06-26,Systems and methods for improved 3D printing,2018
10005127,utility,2018-06-26,Powder improvement for additive manufacturing,2018
10005129,utility,2018-06-26,Method of forming seamless pipe of titanium and/or titanium alloys,2018
10005130,utility,2018-06-26,Machine tool and cutting method,2018
10005131,utility,2018-06-26,Triangular-shaped cutting insert with twelve cutting edges and tool holder therefor,2018
10005132,utility,2018-06-26,Cutting tool and cutting insert having exactly three cutting portions therefor,2018
10005133,utility,2018-06-26,Auto sizing chuck,2018
10005134,utility,2018-06-26,"Drilling method, drilling jig, and heat exchanger",2018
10005135,utility,2018-06-26,Rotary boring tool with detachable cutting inserts and method for machining a cylinder bore of a combustion engine,2018
10005136,utility,2018-06-26,Drill or drill head with burnishing margin,2018
10005137,utility,2018-06-26,Cutting tool,2018
10005138,utility,2018-06-26,Vacuum drilling system and methods,2018
10005139,utility,2018-06-26,Portable milling tool with method for turbomachine milling,2018
10005140,utility,2018-06-26,Machining apparatus,2018
10005141,utility,2018-06-26,Tool holder having insert receiving pocket with stress relief surfaces,2018
10005142,utility,2018-06-26,"Cutting insert, cutting tool, and method of producing machined product",2018
10005143,utility,2018-06-26,"Cutting insert, cutting tool, and method of producing machined product",2018
10005144,utility,2018-06-26,Broach tool rake face with a tailored surface topography,2018
10005145,utility,2018-06-26,Power saw having a dual stage gear train,2018
10005146,utility,2018-06-26,Chain saw chain sharpening device,2018
10005147,utility,2018-06-26,Soldering tip fastening system,2018
10005148,utility,2018-06-26,Chuck device and robot for changing welding tip and nozzle,2018
10005149,utility,2018-06-26,Capacitor-type welding device and capacitor-type welding method,2018
10005150,utility,2018-06-26,Method for manufacturing electronic device,2018
10005151,utility,2018-06-26,Friction stir welding method for steel sheets and method of manufacturing joint,2018
10005152,utility,2018-06-26,Method and apparatus for spiral cutting a glass tube using filamentation by burst ultrafast laser pulses,2018
10005153,utility,2018-06-26,Laser beam welding apparatus and laser beam welding method,2018
10005154,utility,2018-06-26,Laser processing machine,2018
10005155,utility,2018-06-26,Laser cutting device,2018
10005156,utility,2018-06-26,Laser welding apparatus and laser welding method,2018
10005157,utility,2018-06-26,Cathode cutting device using laser,2018
10005158,utility,2018-06-26,Earth-boring tools with precise cutter pocket location and orientation and related methods,2018
10005159,utility,2018-06-26,Method of removing weld flash,2018
10005160,utility,2018-06-26,Repair methods for cooled components,2018
10005161,utility,2018-06-26,Large transmission gearwheel and process for producing a large transmission gearwheel,2018
10005162,utility,2018-06-26,Machine tool including chip conveyor,2018
10005163,utility,2018-06-26,Dust collection system,2018
10005164,utility,2018-06-26,Method for operating at least one hand-held power tool,2018
10005165,utility,2018-06-26,"Device and method of controlling machine tool, to control synchronized operation of spindle axis and feed axis",2018
10005166,utility,2018-06-26,Tool changer,2018
10005167,utility,2018-06-26,Systems and methods for real-time monitoring of micromilling tool wear,2018
10005168,utility,2018-06-26,Device and arrangement for milling inner surface of pipe,2018
10005169,utility,2018-06-26,Modular honing guide system,2018
10005170,utility,2018-06-26,Methods of cleaning CMP polishing pads,2018
10005171,utility,2018-06-26,"Abrasive particles, method of making abrasive particles, and abrasive articles",2018
10005172,utility,2018-06-26,Controlled-porosity method for forming polishing pad,2018
10005173,utility,2018-06-26,Rafter angle square door clamp stand system,2018
10005174,utility,2018-06-26,Anti-disengagement structure of a tool head for a fastener,2018
10005175,utility,2018-06-26,Steering shock compressor systems and methods,2018
10005176,utility,2018-06-26,Hand-held tool machine having a switchable mechanism,2018
10005177,utility,2018-06-26,Adjustable grip size for curved or straight grip,2018
10005178,utility,2018-06-26,Collapsible stand,2018
10005179,utility,2018-06-26,Walking assistant device and method of controlling walking assistant device,2018
10005180,utility,2018-06-26,Robotic servicing multifunctional tool,2018
10005181,utility,2018-06-26,"Manipulator initialization method, manipulator, and manipulator system",2018
10005182,utility,2018-06-26,Robot arm,2018
10005183,utility,2018-06-26,Apparatus for providing robot motion data adaptive to change in work environment and method therefor,2018
10005184,utility,2018-06-26,Industrial robot and a method for controlling an industrial robot,2018
10005185,utility,2018-06-26,Flexible cycle time-optimized sharing of a working space for robots,2018
10005186,utility,2018-06-26,Workpiece conveying device having positioning structure,2018
10005187,utility,2018-06-26,Robotic finger,2018
10005188,utility,2018-06-26,"Parallel link robot, hand for parallel link robot, and parallel link robot system",2018
10005189,utility,2018-06-26,"Extensible and retractable arm mechanism, and robot arm",2018
10005190,utility,2018-06-26,Robot with wrist and end effector different materials,2018
10005191,utility,2018-06-26,Holding apparatus for robot,2018
10005192,utility,2018-06-26,Electric hair clipper,2018
10005193,utility,2018-06-26,Slitter with adjustable shroud,2018
10005194,utility,2018-06-26,Tool path generating device and hairline machining system,2018
10005195,utility,2018-06-26,Corrugated paperboard cutting control apparatus and corrugated paperboard cutting control method,2018
10005196,utility,2018-06-26,Cutting apparatus,2018
10005197,utility,2018-06-26,Nonlinear line of weakness formed by a perforating apparatus,2018
10005198,utility,2018-06-26,Rotary cutting die having inserts for supporting product ejectors,2018
10005199,utility,2018-06-26,Cut-length indicating device,2018
10005200,utility,2018-06-26,Apparatus and method for removing holes in production of biocomposite materials,2018
10005201,utility,2018-06-26,Rotation device for rotationally moulded moldings,2018
10005202,utility,2018-06-26,Automatic machining device for high-speed rail pantograph carbon contact strip and machining method therefor,2018
10005203,utility,2018-06-26,Brick veneer cutting machine,2018
10005204,utility,2018-06-26,Mounting configuration for thermocouple temperature detector on kneader for high viscosity kneading material,2018
10005205,utility,2018-06-26,Reflective helium-free balloon system,2018
10005206,utility,2018-06-26,Method for forming cylindrical rubber member,2018
10005207,utility,2018-06-26,Molded part and method for manufacturing the molded part,2018
10005208,utility,2018-06-26,Method and apparatus for forming three-dimensional image,2018
10005209,utility,2018-06-26,Process for foaming thermoplastic elastomers,2018
10005210,utility,2018-06-26,Injection molded element for slide fastener and slide fastener provided with same,2018
10005211,utility,2018-06-26,"Moldable wire thread insert, method for its production, component with a moldable wire thread insert as well as a method for its production",2018
10005212,utility,2018-06-26,Lacrosse head pocket and related method of manufacture,2018
10005213,utility,2018-06-26,Method for making a filter segment for a disc filter,2018
10005214,utility,2018-06-26,Cap manufacture methods and apparatus,2018
10005215,utility,2018-06-26,Actuator cooling apparatus and method,2018
10005216,utility,2018-06-26,Actuator cooling apparatus and method,2018
10005217,utility,2018-06-26,Ferrite composite sleeve systems and methods for coaxial applications,2018
10005218,utility,2018-06-26,Method for producing expanded granules,2018
10005219,utility,2018-06-26,Robotic electroprosessing system and method,2018
10005220,utility,2018-06-26,Annular die and method for extrusion,2018
10005221,utility,2018-06-26,Method for producing a container from thermoplastic material,2018
10005222,utility,2018-06-26,Process and machinery for integration of discrete parts into composite containers,2018
10005223,utility,2018-06-26,"Blow mold unit, blow molding machine and blow mold unit fixing method",2018
10005224,utility,2018-06-26,Method for forming a headliner,2018
10005225,utility,2018-06-26,"Structure stamp, device and method of embossing",2018
10005226,utility,2018-06-26,Downloadable three-dimensional models,2018
10005227,utility,2018-06-26,Electrostatic 3-D printer using addressable UV crosslinking,2018
10005228,utility,2018-06-26,Electrostatic 3-D printer controlling layer thickness using feedback loop to exposure device,2018
10005229,utility,2018-06-26,System for using optical sensor focus to identify feature heights on objects being produced in a three-dimensional object printer,2018
10005230,utility,2018-06-26,Electrostatic 3-D printer controlling layer thickness using feedback loop to transfer device,2018
10005231,utility,2018-06-26,Method of manufacturing contoured objects by radio frequency welding and tooling assembly for same,2018
10005232,utility,2018-06-26,Method of adhering and conveyor belt,2018
10005233,utility,2018-06-26,Portable system for bonding pipes,2018
10005234,utility,2018-06-26,"Devices, systems, and methods for compacting a charge of composite material across an edge",2018
10005235,utility,2018-06-26,Methods and systems for making a three-dimensional object,2018
10005236,utility,2018-06-26,Cationic polymerizable compositions and methods of use thereof,2018
10005237,utility,2018-06-26,Apparatus and method for forming three-dimensional objects using linear solidification with contourless object data,2018
10005239,utility,2018-06-26,Support structures for additive manufacturing techniques,2018
10005240,utility,2018-06-26,Powder recycling system,2018
10005241,utility,2018-06-26,Method for producing a rotor blade and rotor blade of a wind turbine,2018
10005242,utility,2018-06-26,Systems and methods of constructing composite assemblies,2018
10005243,utility,2018-06-26,"Method for producing a fibre composite component by means of a vacuum build-up, and use therefor",2018
10005244,utility,2018-06-26,Manufacturing method of pressure vessel with heating device,2018
10005245,utility,2018-06-26,Method for making a carbon fiber wheel rim,2018
10005246,utility,2018-06-26,Methods for making interior panels for motor vehicles,2018
10005247,utility,2018-06-26,Electromagnetic processing line,2018
10005248,utility,2018-06-26,Method and kit for forming plastic lenses from molds formed on surface with varied wettability,2018
10005249,utility,2018-06-26,Method of manufacturing an eyeglass lens with gradation and eyeglass lens,2018
10005250,utility,2018-06-26,"Injection molding apparatus for manufacturing hollow objects, in particular plastic preforms, resp. containers and method therefor",2018
10005251,utility,2018-06-26,Decorated sole elements for articles of footwear and processes for making thereof,2018
10005252,utility,2018-06-26,Screw press,2018
10005253,utility,2018-06-26,Fuel containment autonomous self-sealing system,2018
10005254,utility,2018-06-26,Silicone-containing roof assemblies and methods for production and use,2018
10005255,utility,2018-06-26,Long fiber nonwoven fabric and laminate of fabrics having long fiber nonwoven fabric,2018
10005256,utility,2018-06-26,Selectively weakened stretched films,2018
10005257,utility,2018-06-26,Method for producing pressure-sensitive adhesive layer-carrying optical film,2018
10005258,utility,2018-06-26,"Layered structure with barrier layer, apparel piece with such a layered structure and production of such a layered structure",2018
10005259,utility,2018-06-26,Packaging device for a hair dyeing product,2018
10005260,utility,2018-06-26,Optically transmissive antimicrobial glass with shielding effect for electromagnetic wave,2018
10005261,utility,2018-06-26,Flexible containers,2018
10005262,utility,2018-06-26,Heat shrinkable polyolefin film and a preparation method thereof,2018
10005263,utility,2018-06-26,Display device and method of manufacturing a display device,2018
10005264,utility,2018-06-26,Thin protective display film,2018
10005265,utility,2018-06-26,Layered border for touch sensor device,2018
10005266,utility,2018-06-26,Apparatuses and methods for bonding substrates,2018
10005267,utility,2018-06-26,Formation of complex composite structures using laminate templates,2018
10005268,utility,2018-06-26,Method for the continuous production of laminates made of fibre bands and use thereof,2018
10005269,utility,2018-06-26,Rotational spun material covered medical appliances and methods of manufacture,2018
10005270,utility,2018-06-26,Vacuum jigs including ultraviolet light sensors and methods of operating the same,2018
10005271,utility,2018-06-26,Chips with hermetically sealed but openable chambers,2018
10005272,utility,2018-06-26,"Intermediate transfer body, image recording method, and image forming apparatus",2018
10005273,utility,2018-06-26,Printing base and inkjet printing method,2018
10005274,utility,2018-06-26,Image forming device and dot pattern determining method,2018
10005275,utility,2018-06-26,Liquid discharging apparatus and discharge state determination method of liquid in liquid discharging apparatus,2018
10005276,utility,2018-06-26,Modules to evaluate ink signals,2018
10005277,utility,2018-06-26,"Liquid discharging apparatus, head unit, integrated circuit device for capacitive load driving, capacitive load driving circuit, and control method of liquid discharging apparatus",2018
10005278,utility,2018-06-26,Semiconductor device and liquid discharge head substrate,2018
10005279,utility,2018-06-26,"Method for manufacturing MEMS device, MEMS device, liquid ejecting head, and liquid ejecting apparatus",2018
10005280,utility,2018-06-26,Liquid ejecting head and liquid ejecting apparatus,2018
10005281,utility,2018-06-26,"Liquid ejection head, liquid ejection unit, and apparatus for ejecting liquid",2018
10005282,utility,2018-06-26,Fluid ejection devices with particle tolerant thin-film extensions,2018
10005283,utility,2018-06-26,Method for manufacturing liquid ejection head,2018
10005284,utility,2018-06-26,Liquid ejecting apparatus and cleaning device,2018
